{
    "format": "af-annotations",
    "version": "v0.0.1",
    "reference": {
        "timeline_camera": "head_color",
        "total_frames": 159,
        "frame_index_origin": 0,
        "interval": "half_open"
    },
    "main": [],
    "region_marker": {
        "success_markers": [],
        "interference_markers": [],
        "error_markers": [],
        "single_frame_markers": []
    }
}
